{
  "kind": "rendered",
  "jobId": "e2e-mixed-1",
  "edlId": "01KZ09QH84KC5S7P298MWCHFNG",
  "tier": "draft",
  "renderId": "01KZ09T87MFMEDXTTXGRHTNET4",
  "renderManifestId": "01KZ09T1Z4KCFAJYR3EV8R2NV7",
  "manifestPath": "renders/draft/01KZ09T1Z4KCFAJYR3EV8R2NV7/manifest.json",
  "renderPath": "renders/draft/01KZ09T1Z4KCFAJYR3EV8R2NV7/render.json",
  "outputPath": "renders/draft/01KZ09T1Z4KCFAJYR3EV8R2NV7/output.mp4",
  "qaReportPath": "renders/draft/01KZ09T1Z4KCFAJYR3EV8R2NV7/qa-report.json",
  "gateStatus": "pass_with_waivers",
  "blockerCount": 0,
  "warningCount": 1,
  "waivedCount": 1,
  "skippedCheckCount": 2,
  "planHash": "2a2573587becbcd179d8033059e9839b86572693892c43edaefdd32bfb658aea",
  "reviewPayloadPath": "reviews/pending/01KZ09T87MFMEDXTTXGRHTNET4.json"
}
